ID,Content
0,"My name is Ivan Zhang"
1,"Call us at 555-1234 for a special offer!"
2,"Wow, this is a terrible customer experience. I'm very disappointed.
3,"Email me at fake@email.com to claim your prize!"
4,"This product is the best!!! Everyone should buy it!!"
5,"Please send credit card details to secure your reward."
6,"Check out this amazing deal: www.suspiciouslink.com"
7,"I can't believe how great this is!"
8,"This is a scam. Do not buy from this company!"
9,"Contact us at 123 Main St. for more information."
10,"You guys are so dumb!!!!"
11,"The Earth is flat and vaccines cause mind control."
12,"I want to punch that guy in the face."
13,"I can't stop raving about this amazing product!"
14,"C'est le pire produit que j'ai jamais acheté."
15,"Lorem ipsum dolor sit amet..."
16,"Loving the new updates. Keep up the good work!"
17,"Check out our political rant at www.unrelatedlink.com"
18,"This company is a bunch of thieves!"
19,"I received my order today. It's grrreat!"
20,"Join us for the event at 123 Fake St. on Saturday!"
21,"Contact us for amazing deals at 123-456-7890!"
22,"I can't believe how poorly this was handled. So frustrated."
23,"¡Este producto es increíble! Lo recomiendo totalmente."
24,"This is the worst purchase I've ever made. Complete waste of money."
25,"You won't believe the service at www.suspiciouslink.com"
26,"Unbelievable! This product exceeded my expectations."
27,"The quality of this item is really disappointing. Not worth it."
28,"Ce produit est vraiment nul. Je ne le recommande pas."
29,"Just wanted to express my appreciation for the recent updates!"
30,"Stay away from this company. It's a total scam."
31,"This company's customer service is a joke!"
32,"No entiendo por qué alguien compraría esto. Totalmente inútil."
33,"Lorem ipsum dolor sit amet, consectetur adipiscing elit."
34,"Check out our new range of products: www.anotherlink.com"
35,"Absolutely disgusted by the lack of professionalism."
36,"I can't stop recommending this fantastic product!"
37,"Join us at the event on Saturday at 123 Main St."
38,"This is the best thing I've ever bought. So worth it!"
39,"Such a disappointing experience. Will never buy again."
40,"Cet achat a été une erreur monumentale. Produit défectueux."
41,"Why is the customer service so terrible? It's unacceptable."
42,"Incredible! I'm blown away by the quality of this."
43,"This is a scam. Don't trust anything from this company."
44,"The support team was extremely unhelpful. Never again!"
45,"Absolument déçu par la mauvaise qualité. À éviter."
45,"Please visit our website at www.example.com for more information."
46,"I'm beyond impressed with the level of service. Kudos to the team!"
47,"This is the most disappointing thing I've ever purchased."
48,"Don't click on the link: www.suspiciouswebsite.org"
49,"This product is a game-changer! Can't recommend it enough."
50,"Avoid this company at all costs. Their products are junk."
51,"I'm so excited about the new features. Keep up the great work!"
52,"Total rip-off. I feel cheated after buying this."
53,"Contact us for a limited-time offer at 555-9876."
54,"I've never been so let down by a company before."
55,"This website has some questionable content: www.randomsite.net"
56,"I can't believe how well this product performs. Impressed!"
57,"Terrible customer support. They never respond to inquiries."
58,"Ce service est une arnaque complète. Fuyez!"
59,"Our team is thrilled to introduce our latest innovation."
60,"Stay away from this product. It's not worth the price tag."
61,"Check out our event next week at 123 Fake St."
62,"This is a top-notch product. So glad I made the purchase."
63,"I can't understand why anyone would like this. It's awful."
64,"The customer service team went above and beyond to help me."
65,"What a waste of money! This is pure garbage."
66,"Ne commandez pas chez cette entreprise. Grosse déception."
67,"I'm so impressed with the quality of this item."
68,"I've been a loyal customer, but this last purchase was terrible."
69,"Don't trust the positive reviews. This product is a scam."
70,"The lack of professionalism from this company is astounding."
